# 2001 September 15
#
# The author disclaims copyright to this source code.  In place of
# a legal notice, here is a blessing:
#
#    May you do good and not evil.
#    May you find forgiveness for yourself and forgive others.
#    May you share freely, never taking more than you give.
#
#***********************************************************************
# This file implements regression tests for SQLite library.  The
# focus of this file is testing the CREATE INDEX statement.
#
# $Id: index.test,v 1.43 2008/01/16 18:20:42 danielk1977 Exp $

set testdir [file dirname $argv0]
source $testdir/tester.tcl

# Create a basic index and verify it is added to sqlite_master
#
do_test index-1.1 {
  execsql {CREATE TABLE test1(f1 int, f2 int, f3 int)}
  execsql {CREATE INDEX index1 ON test1(f1)}
  execsql {SELECT name FROM sqlite_master WHERE type!='meta' ORDER BY name}
} {index1 test1}
do_test index-1.1b {
  execsql {SELECT name, sql, tbl_name, type FROM sqlite_master 
           WHERE name='index1'}
} {index1 {CREATE INDEX index1 ON test1(f1)} test1 index}
do_test index-1.1c {
  db close
  sqlite3 db test.db
  execsql {SELECT name, sql, tbl_name, type FROM sqlite_master 
           WHERE name='index1'}
} {index1 {CREATE INDEX index1 ON test1(f1)} test1 index}
do_test index-1.1d {
  db close
  sqlite3 db test.db
  execsql {SELECT name FROM sqlite_master WHERE type!='meta' ORDER BY name}
} {index1 test1}

# Verify that the index dies with the table
#
do_test index-1.2 {
  execsql {DROP TABLE test1}
  execsql {SELECT name FROM sqlite_master WHERE type!='meta' ORDER BY name}
} {}

# Try adding an index to a table that does not exist
#
do_test index-2.1 {
  set v [catch {execsql {CREATE INDEX index1 ON test1(f1)}} msg]
  lappend v $msg
} {1 {no such table: main.test1}}

# Try adding an index on a column of a table where the table
# exists but the column does not.
#
do_test index-2.1b {
  execsql {CREATE TABLE test1(f1 int, f2 int, f3 int)}
  set v [catch {execsql {CREATE INDEX index1 ON test1(f4)}} msg]
  lappend v $msg
} {1 {no such column: f4}}

# Try an index with some columns that match and others that do now.
#
do_test index-2.2 {
  set v [catch {execsql {CREATE INDEX index1 ON test1(f1, f2, f4, f3)}} msg]
  execsql {DROP TABLE test1}
  lappend v $msg
} {1 {no such column: f4}}

# Try creating a bunch of indices on the same table
#
set r {}
for {set i 1} {$i<100} {incr i} {
  lappend r [format index%02d $i]
}
do_test index-3.1 {
  execsql {CREATE TABLE test1(f1 int, f2 int, f3 int, f4 int, f5 int)}
  for {set i 1} {$i<100} {incr i} {
    set sql "CREATE INDEX [format index%02d $i] ON test1(f[expr {($i%5)+1}])"
    execsql $sql
  }
  execsql {SELECT name FROM sqlite_master 
           WHERE type='index' AND tbl_name='test1'
           ORDER BY name}
} $r
integrity_check index-3.2.1
ifcapable {reindex} {
  do_test index-3.2.2 {
    execsql REINDEX
  } {}
}
integrity_check index-3.2.3


# Verify that all the indices go away when we drop the table.
#
do_test index-3.3 {
  execsql {DROP TABLE test1}
  execsql {SELECT name FROM sqlite_master 
           WHERE type='index' AND tbl_name='test1'
           ORDER BY name}
} {}

# Create a table and insert values into that table.  Then create
# an index on that table.  Verify that we can select values
# from the table correctly using the index.
#
# Note that the index names "index9" and "indext" are chosen because
# they both have the same hash.
#
do_test index-4.1 {
  execsql {CREATE TABLE test1(cnt int, power int)}
  for {set i 1} {$i<20} {incr i} {
    execsql "INSERT INTO test1 VALUES($i,[expr {1<<$i}])"
  }
  execsql {CREATE INDEX index9 ON test1(cnt)}
  execsql {CREATE INDEX indext ON test1(power)}
  execsql {SELECT name FROM sqlite_master WHERE type!='meta' ORDER BY name}
} {index9 indext test1}
do_test index-4.2 {
  execsql {SELECT cnt FROM test1 WHERE power=4}
} {2}
do_test index-4.3 {
  execsql {SELECT cnt FROM test1 WHERE power=1024}
} {10}
do_test index-4.4 {
  execsql {SELECT power FROM test1 WHERE cnt=6}
} {64}
do_test index-4.5 {
  execsql {DROP INDEX indext}
  execsql {SELECT power FROM test1 WHERE cnt=6}
} {64}
do_test index-4.6 {
  execsql {SELECT cnt FROM test1 WHERE power=1024}
} {10}
do_test index-4.7 {
  execsql {CREATE INDEX indext ON test1(cnt)}
  execsql {SELECT power FROM test1 WHERE cnt=6}
} {64}
do_test index-4.8 {
  execsql {SELECT cnt FROM test1 WHERE power=1024}
} {10}
do_test index-4.9 {
  execsql {DROP INDEX index9}
  execsql {SELECT power FROM test1 WHERE cnt=6}
} {64}
do_test index-4.10 {
  execsql {SELECT cnt FROM test1 WHERE power=1024}
} {10}
do_test index-4.11 {
  execsql {DROP INDEX indext}
  execsql {SELECT power FROM test1 WHERE cnt=6}
} {64}
do_test index-4.12 {
  execsql {SELECT cnt FROM test1 WHERE power=1024}
} {10}
do_test index-4.13 {
  execsql {DROP TABLE test1}
  execsql {SELECT name FROM sqlite_master WHERE type!='meta' ORDER BY name}
} {}
integrity_check index-4.14

# Do not allow indices to be added to sqlite_master
#
do_test index-5.1 {
  set v [catch {execsql {CREATE INDEX index1 ON sqlite_master(name)}} msg]
  lappend v $msg
} {1 {table sqlite_master may not be indexed}}
do_test index-5.2 {
  execsql {SELECT name FROM sqlite_master WHERE type!='meta'}
} {}

# Do not allow indices with duplicate names to be added
#
do_test index-6.1 {
  execsql {CREATE TABLE test1(f1 int, f2 int)}
  execsql {CREATE TABLE test2(g1 real, g2 real)}
  execsql {CREATE INDEX index1 ON test1(f1)}
  set v [catch {execsql {CREATE INDEX index1 ON test2(g1)}} msg]
  lappend v $msg
} {1 {index index1 already exists}}
do_test index-6.1.1 {
  catchsql {CREATE INDEX [index1] ON test2(g1)}
} {1 {index index1 already exists}}
do_test index-6.1b {
  execsql {SELECT name FROM sqlite_master WHERE type!='meta' ORDER BY name}
} {index1 test1 test2}
do_test index-6.1c {
  catchsql {CREATE INDEX IF NOT EXISTS index1 ON test1(f1)}
} {0 {}}
do_test index-6.2 {
  set v [catch {execsql {CREATE INDEX test1 ON test2(g1)}} msg]
  lappend v $msg
} {1 {there is already a table named test1}}
do_test index-6.2b {
  execsql {SELECT name FROM sqlite_master WHERE type!='meta' ORDER BY name}
} {index1 test1 test2}
do_test index-6.3 {
  execsql {DROP TABLE test1}
  execsql {DROP TABLE test2}
  execsql {SELECT name FROM sqlite_master WHERE type!='meta' ORDER BY name}
} {}
do_test index-6.4 {
  execsql {
    CREATE TABLE test1(a,b);
    CREATE INDEX index1 ON test1(a);
    CREATE INDEX index2 ON test1(b);
    CREATE INDEX index3 ON test1(a,b);
    DROP TABLE test1;
    SELECT name FROM sqlite_master WHERE type!='meta' ORDER BY name;
  }
} {}
integrity_check index-6.5


# Create a primary key
#
do_test index-7.1 {
  execsql {CREATE TABLE test1(f1 int, f2 int primary key)}
  for {set i 1} {$i<20} {incr i} {
    execsql "INSERT INTO test1 VALUES($i,[expr {1<<$i}])"
  }
  execsql {SELECT count(*) FROM test1}
} {19}
do_test index-7.2 {
  execsql {SELECT f1 FROM test1 WHERE f2=65536}
} {16}
do_test index-7.3 {
  execsql {
    SELECT name FROM sqlite_master 
    WHERE type='index' AND tbl_name='test1'
  }
} {sqlite_autoindex_test1_1}
do_test index-7.4 {
  execsql {DROP table test1}
  execsql {SELECT name FROM sqlite_master WHERE type!='meta'}
} {}
integrity_check index-7.5

# Make sure we cannot drop a non-existant index.
#
do_test index-8.1 {
  set v [catch {execsql {DROP INDEX index1}} msg]
  lappend v $msg
} {1 {no such index: index1}}

# Make sure we don't actually create an index when the EXPLAIN keyword
# is used.
#
do_test index-9.1 {
  execsql {CREATE TABLE tab1(a int)}
  ifcapable {explain} {
    execsql {EXPLAIN CREATE INDEX idx1 ON tab1(a)}
  }
  execsql {SELECT name FROM sqlite_master WHERE tbl_name='tab1'}
} {tab1}
do_test index-9.2 {
  execsql {CREATE INDEX idx1 ON tab1(a)}
  execsql {SELECT name FROM sqlite_master WHERE tbl_name='tab1' ORDER BY name}
} {idx1 tab1}
integrity_check index-9.3

# Allow more than one entry with the same key.
#
do_test index-10.0 {
  execsql {
    CREATE TABLE t1(a int, b int);
    CREATE INDEX i1 ON t1(a);
    INSERT INTO t1 VALUES(1,2);
    INSERT INTO t1 VALUES(2,4);
    INSERT INTO t1 VALUES(3,8);
    INSERT INTO t1 VALUES(1,12);
    SELECT b FROM t1 WHERE a=1 ORDER BY b;
  }
} {2 12}
do_test index-10.1 {
  execsql {
    SELECT b FROM t1 WHERE a=2 ORDER BY b;
  }
} {4}
do_test index-10.2 {
  execsql {
    DELETE FROM t1 WHERE b=12;
    SELECT b FROM t1 WHERE a=1 ORDER BY b;
  }
} {2}
do_test index-10.3 {
  execsql {
    DELETE FROM t1 WHERE b=2;
    SELECT b FROM t1 WHERE a=1 ORDER BY b;
  }
} {}
do_test index-10.4 {
  execsql {
    DELETE FROM t1;
    INSERT INTO t1 VALUES (1,1);
    INSERT INTO t1 VALUES (1,2);
    INSERT INTO t1 VALUES (1,3);
    INSERT INTO t1 VALUES (1,4);
    INSERT INTO t1 VALUES (1,5);
    INSERT INTO t1 VALUES (1,6);
    INSERT INTO t1 VALUES (1,7);
    INSERT INTO t1 VALUES (1,8);
    INSERT INTO t1 VALUES (1,9);
    INSERT INTO t1 VALUES (2,0);
    SELECT b FROM t1 WHERE a=1 ORDER BY b;
  }
} {1 2 3 4 5 6 7 8 9}
do_test index-10.5 {
  ifcapable subquery {
    execsql { DELETE FROM t1 WHERE b IN (2, 4, 6, 8); }
  } else {
    execsql { DELETE FROM t1 WHERE b = 2 OR b = 4 OR b = 6 OR b = 8; }
  }
  execsql {
    SELECT b FROM t1 WHERE a=1 ORDER BY b;
  }
} {1 3 5 7 9}
do_test index-10.6 {
  execsql {
    DELETE FROM t1 WHERE b>2;
    SELECT b FROM t1 WHERE a=1 ORDER BY b;
  }
} {1}
do_test index-10.7 {
  execsql {
    DELETE FROM t1 WHERE b=1;
    SELECT b FROM t1 WHERE a=1 ORDER BY b;
  }
} {}
do_test index-10.8 {
  execsql {
    SELECT b FROM t1 ORDER BY b;
  }
} {0}
integrity_check index-10.9

# Automatically create an index when we specify a primary key.
#
do_test index-11.1 {
  execsql {
    CREATE TABLE t3(
      a text,
      b int,
      c float,
      PRIMARY KEY(b)
    );
  }
  for {set i 1} {$i<=50} {incr i} {
    execsql "INSERT INTO t3 VALUES('x${i}x',$i,0.$i)"
  }
  set sqlite_search_count 0
  concat [execsql {SELECT c FROM t3 WHERE b==10}] $sqlite_search_count
} {0.1 2}
integrity_check index-11.2


# Numeric strings should compare as if they were numbers.  So even if the
# strings are not character-by-character the same, if they represent the
# same number they should compare equal to one another.  Verify that this
# is true in indices.
#
# Updated for sqlite3 v3: SQLite will now store these values as numbers
# (because the affinity of column a is NUMERIC) so the quirky
# representations are not retained. i.e. '+1.0' becomes '1'.
do_test index-12.1 {
  execsql {
    CREATE TABLE t4(a NUM,b);
    INSERT INTO t4 VALUES('0.0',1);
    INSERT INTO t4 VALUES('0.00',2);
    INSERT INTO t4 VALUES('abc',3);
    INSERT INTO t4 VALUES('-1.0',4);
    INSERT INTO t4 VALUES('+1.0',5);
    INSERT INTO t4 VALUES('0',6);
    INSERT INTO t4 VALUES('00000',7);
    SELECT a FROM t4 ORDER BY b;
  }
} {0 0 abc -1 1 0 0}
do_test index-12.2 {
  execsql {
    SELECT a FROM t4 WHERE a==0 ORDER BY b
  }
} {0 0 0 0}
do_test index-12.3 {
  execsql {
    SELECT a FROM t4 WHERE a<0.5 ORDER BY b
  }
} {0 0 -1 0 0}
do_test index-12.4 {
  execsql {
    SELECT a FROM t4 WHERE a>-0.5 ORDER BY b
  }
} {0 0 abc 1 0 0}
do_test index-12.5 {
  execsql {
    CREATE INDEX t4i1 ON t4(a);
    SELECT a FROM t4 WHERE a==0 ORDER BY b
  }
} {0 0 0 0}
do_test index-12.6 {
  execsql {
    SELECT a FROM t4 WHERE a<0.5 ORDER BY b
  }
} {0 0 -1 0 0}
do_test index-12.7 {
  execsql {
    SELECT a FROM t4 WHERE a>-0.5 ORDER BY b
  }
} {0 0 abc 1 0 0}
integrity_check index-12.8

# Make sure we cannot drop an automatically created index.
#
do_test index-13.1 {
  execsql {
   CREATE TABLE t5(
      a int UNIQUE,
      b float PRIMARY KEY,
      c varchar(10),
      UNIQUE(a,c)
   );
   INSERT INTO t5 VALUES(1,2,3);
   SELECT * FROM t5;
  }
} {1 2.0 3}
do_test index-13.2 {
  set ::idxlist [execsql {
    SELECT name FROM sqlite_master WHERE type='index' AND tbl_name='t5';
  }]
  llength $::idxlist
} {3}
for {set i 0} {$i<[llength $::idxlist]} {incr i} {
  do_test index-13.3.$i {
    catchsql "
      DROP INDEX '[lindex $::idxlist $i]';
    "
  } {1 {index associated with UNIQUE or PRIMARY KEY constraint cannot be dropped}}
}
do_test index-13.4 {
  execsql {
    INSERT INTO t5 VALUES('a','b','c');
    SELECT * FROM t5;
  }
} {1 2.0 3 a b c}
integrity_check index-13.5

# Check the sort order of data in an index.
#
do_test index-14.1 {
  execsql {
    CREATE TABLE t6(a,b,c);
    CREATE INDEX t6i1 ON t6(a,b);
    INSERT INTO t6 VALUES('','',1);
    INSERT INTO t6 VALUES('',NULL,2);
    INSERT INTO t6 VALUES(NULL,'',3);
    INSERT INTO t6 VALUES('abc',123,4);
    INSERT INTO t6 VALUES(123,'abc',5);
    SELECT c FROM t6 ORDER BY a,b;
  }
} {3 5 2 1 4}
do_test index-14.2 {
  execsql {
    SELECT c FROM t6 WHERE a='';
  }
} {2 1}
do_test index-14.3 {
  execsql {
    SELECT c FROM t6 WHERE b='';
  }
} {1 3}
do_test index-14.4 {
  execsql {
    SELECT c FROM t6 WHERE a>'';
  }
} {4}
do_test index-14.5 {
  execsql {
    SELECT c FROM t6 WHERE a>='';
  }
} {2 1 4}
do_test index-14.6 {
  execsql {
    SELECT c FROM t6 WHERE a>123;
  }
} {2 1 4}
do_test index-14.7 {
  execsql {
    SELECT c FROM t6 WHERE a>=123;
  }
} {5 2 1 4}
do_test index-14.8 {
  execsql {
    SELECT c FROM t6 WHERE a<'abc';
  }
} {5 2 1}
do_test index-14.9 {
  execsql {
    SELECT c FROM t6 WHERE a<='abc';
  }
} {5 2 1 4}
do_test index-14.10 {
  execsql {
    SELECT c FROM t6 WHERE a<='';
  }
} {5 2 1}
do_test index-14.11 {
  execsql {
    SELECT c FROM t6 WHERE a<'';
  }
} {5}
integrity_check index-14.12

do_test index-15.1 {
  execsql {
    DELETE FROM t1;
    SELECT * FROM t1;
  }
} {}
do_test index-15.2 {
  execsql {
    INSERT INTO t1 VALUES('1.234e5',1);
    INSERT INTO t1 VALUES('12.33e04',2);
    INSERT INTO t1 VALUES('12.35E4',3);
    INSERT INTO t1 VALUES('12.34e',4);
    INSERT INTO t1 VALUES('12.32e+4',5);
    INSERT INTO t1 VALUES('12.36E+04',6);
    INSERT INTO t1 VALUES('12.36E+',7);
    INSERT INTO t1 VALUES('+123.10000E+0003',8);
    INSERT INTO t1 VALUES('+',9);
    INSERT INTO t1 VALUES('+12347.E+02',10);
    INSERT INTO t1 VALUES('+12347E+02',11);
    INSERT INTO t1 VALUES('+.125E+04',12);
    INSERT INTO t1 VALUES('-.125E+04',13);
    INSERT INTO t1 VALUES('.125E+0',14);
    INSERT INTO t1 VALUES('.125',15);
    SELECT b FROM t1 ORDER BY a, b;
  }
} {13 14 15 12 8 5 2 1 3 6 10 11 9 4 7}
do_test index-15.3 {
  execsql {
    SELECT b FROM t1 WHERE typeof(a) IN ('integer','real') ORDER BY b;
  }
} {1 2 3 5 6 8 10 11 12 13 14 15}
integrity_check index-15.4

# The following tests - index-16.* - test that when a table definition
# includes qualifications that specify the same constraint twice only a
# single index is generated to enforce the constraint.
#
# For example: "CREATE TABLE abc( x PRIMARY KEY, UNIQUE(x) );"
#
do_test index-16.1 {
  execsql {
    CREATE TABLE t7(c UNIQUE PRIMARY KEY);
    SELECT count(*) FROM sqlite_master WHERE tbl_name = 't7' AND type = 'index';
  }
} {1}
do_test index-16.2 {
  execsql {
    DROP TABLE t7;
    CREATE TABLE t7(c UNIQUE PRIMARY KEY);
    SELECT count(*) FROM sqlite_master WHERE tbl_name = 't7' AND type = 'index';
  }
} {1}
do_test index-16.3 {
  execsql {
    DROP TABLE t7;
    CREATE TABLE t7(c PRIMARY KEY, UNIQUE(c) );
    SELECT count(*) FROM sqlite_master WHERE tbl_name = 't7' AND type = 'index';
  }
} {1}
do_test index-16.4 {
  execsql {
    DROP TABLE t7;
    CREATE TABLE t7(c, d , UNIQUE(c, d), PRIMARY KEY(c, d) );
    SELECT count(*) FROM sqlite_master WHERE tbl_name = 't7' AND type = 'index';
  }
} {1}
do_test index-16.5 {
  execsql {
    DROP TABLE t7;
    CREATE TABLE t7(c, d , UNIQUE(c), PRIMARY KEY(c, d) );
    SELECT count(*) FROM sqlite_master WHERE tbl_name = 't7' AND type = 'index';
  }
} {2}

# Test that automatically create indices are named correctly. The current
# convention is: "sqlite_autoindex_<table name>_<integer>"
#
# Then check that it is an error to try to drop any automtically created
# indices.
do_test index-17.1 {
  execsql {
    DROP TABLE t7;
    CREATE TABLE t7(c, d UNIQUE, UNIQUE(c), PRIMARY KEY(c, d) );
    SELECT name FROM sqlite_master WHERE tbl_name = 't7' AND type = 'index';
  }
} {sqlite_autoindex_t7_1 sqlite_autoindex_t7_2 sqlite_autoindex_t7_3}
do_test index-17.2 {
  catchsql {
    DROP INDEX sqlite_autoindex_t7_1;
  }
} {1 {index associated with UNIQUE or PRIMARY KEY constraint cannot be dropped}}
do_test index-17.3 {
  catchsql {
    DROP INDEX IF EXISTS sqlite_autoindex_t7_1;
  }
} {1 {index associated with UNIQUE or PRIMARY KEY constraint cannot be dropped}}
do_test index-17.4 {
  catchsql {
    DROP INDEX IF EXISTS no_such_index;
  }
} {0 {}}


# The following tests ensure that it is not possible to explicitly name
# a schema object with a name beginning with "sqlite_". Granted that is a
# little outside the focus of this test scripts, but this has got to be
# tested somewhere.
do_test index-18.1 {
  catchsql {
    CREATE TABLE sqlite_t1(a, b, c);
  }
} {1 {object name reserved for internal use: sqlite_t1}}
do_test index-18.1.2 {
  catchsql {
    CREATE TABLE sqlite_t1(a, b, c);
  }
} {1 {object name reserved for internal use: sqlite_t1}}
sqlite3_db_config db DEFENSIVE 0
do_test index-18.2 {
  catchsql {
    CREATE INDEX sqlite_i1 ON t7(c);
  }
} {1 {object name reserved for internal use: sqlite_i1}}
ifcapable view {
do_test index-18.3 {
  catchsql {
    CREATE VIEW sqlite_v1 AS SELECT * FROM t7;
  }
} {1 {object name reserved for internal use: sqlite_v1}}
} ;# ifcapable view
ifcapable {trigger} {
  do_test index-18.4 {
    catchsql {
      CREATE TRIGGER sqlite_tr1 BEFORE INSERT ON t7 BEGIN SELECT 1; END;
    }
  } {1 {object name reserved for internal use: sqlite_tr1}}
}
do_test index-18.5 {
  execsql {
    DROP TABLE t7;
  }
} {}

# These tests ensure that if multiple table definition constraints are
# implemented by a single indice, the correct ON CONFLICT policy applies.
ifcapable conflict {
  do_test index-19.1 {
    execsql {
      CREATE TABLE t7(a UNIQUE PRIMARY KEY);
      CREATE TABLE t8(a UNIQUE PRIMARY KEY ON CONFLICT ROLLBACK);
      INSERT INTO t7 VALUES(1);
      INSERT INTO t8 VALUES(1);
    }
  } {}
  do_test index-19.2 {
    catchsql {
      BEGIN;
      INSERT INTO t7 VALUES(1);
    }
  } {1 {UNIQUE constraint failed: t7.a}}
  do_test index-19.3 {
    catchsql {
      BEGIN;
    }
  } {1 {cannot start a transaction within a transaction}}
  do_test index-19.4 {
    catchsql {
      INSERT INTO t8 VALUES(1);
    }
  } {1 {UNIQUE constraint failed: t8.a}}
  do_test index-19.5 {
    catchsql {
      BEGIN;
      COMMIT;
    }
  } {0 {}}
  do_test index-19.6 {
    catchsql {
      DROP TABLE t7;
      DROP TABLE t8;
      CREATE TABLE t7(
         a PRIMARY KEY ON CONFLICT FAIL, 
         UNIQUE(a) ON CONFLICT IGNORE
      );
    }
  } {1 {conflicting ON CONFLICT clauses specified}}
} ; # end of "ifcapable conflict" block

ifcapable {reindex} {
  do_test index-19.7 {
    execsql REINDEX
  } {}
}
integrity_check index-19.8

# Drop index with a quoted name.  Ticket #695.
#
do_test index-20.1 {
  execsql {
    CREATE INDEX "t6i2" ON t6(c);
    DROP INDEX "t6i2";
  }
} {}
do_test index-20.2 {
  execsql {
    DROP INDEX "t6i1";
  }
} {}

# Try to create a TEMP index on a non-TEMP table. */
#
do_test index-21.1 {
  catchsql {
     CREATE INDEX temp.i21 ON t6(c);
  }
} {1 {cannot create a TEMP index on non-TEMP table "t6"}}
do_test index-21.2 {
  catchsql {
     CREATE TEMP TABLE t6(x);
     INSERT INTO temp.t6 values(1),(5),(9);
     CREATE INDEX temp.i21 ON t6(x);
     SELECT x FROM t6 ORDER BY x DESC;
  }
} {0 {9 5 1}}

# 2019-05-01 ticket https://sqlite.org/src/info/3be1295b264be2fa
do_execsql_test index-22.0 {
  DROP TABLE IF EXISTS t1;
  CREATE TABLE t1(a, b TEXT);
  CREATE UNIQUE INDEX IF NOT EXISTS x1 ON t1(b==0);
  CREATE INDEX IF NOT EXISTS x2 ON t1(a || 0) WHERE b;
  INSERT INTO t1(a,b) VALUES('a',1),('a',0);
  SELECT a, b, '|' FROM t1;
} {a 1 | a 0 |}

# 2019-05-10 ticket https://sqlite.org/src/info/ae0f637bddc5290b
do_execsql_test index-23.0 {
  DROP TABLE t1;
  CREATE TABLE t1(a TEXT, b REAL);
  CREATE UNIQUE INDEX t1x1 ON t1(a GLOB b);
  INSERT INTO t1(a,b) VALUES('0.0','1'),('1.0','1');
  SELECT * FROM t1;
  REINDEX;
} {0.0 1.0 1.0 1.0}
do_execsql_test index-23.1 {
  DROP TABLE t1;
  CREATE TABLE t1(a REAL);
  CREATE UNIQUE INDEX index_0 ON t1(TYPEOF(a));
  INSERT OR IGNORE INTO t1(a) VALUES (0.1),(FALSE);
  SELECT * FROM t1;
  REINDEX;
} {0.1}

#-------------------------------------------------------------------------
# Tests for virtual generated columns and explicitly specified covering indexes.
#

ifcapable {generated_columns && without_rowid} {
  do_test index-vcov-1.1 {
    execsql {
      CREATE TABLE t_gen_wr (
        id INTEGER PRIMARY KEY,
        data TEXT,
        gen_virt AS (id || ':' || upper(data)) VIRTUAL
      ) WITHOUT ROWID;
      INSERT INTO t_gen_wr(id, data) VALUES (1, 'one'), (2, 'two'), (3, 'three');

      CREATE INDEX idx_gen_virt_vc_wr ON t_gen_wr(gen_virt);
      CREATE INDEX idx_gen_virt_vc_data_wr ON t_gen_wr(gen_virt, data);
      CREATE INDEX idx_gen_virt_id_vc_wr ON t_gen_wr(id, gen_virt);
    }
  } {}

  # EQP Tests for t_gen_wr
  do_eqp_test index-vcov-1.2 {
    SELECT gen_virt FROM t_gen_wr INDEXED BY idx_gen_virt_vc_wr WHERE gen_virt = '2:TWO';
  } {/SEARCH t_gen_wr USING COVERING INDEX idx_gen_virt_vc_wr/}

  do_eqp_test index-vcov-1.3 {
    SELECT id, gen_virt FROM t_gen_wr INDEXED BY idx_gen_virt_id_vc_wr WHERE id = 2;
  } {/SEARCH t_gen_wr USING COVERING INDEX idx_gen_virt_id_vc_wr/}

  do_eqp_test index-vcov-1.4 {
    SELECT data, gen_virt FROM t_gen_wr INDEXED BY idx_gen_virt_vc_data_wr WHERE data = 'two';
  } {/SEARCH t_gen_wr USING COVERING INDEX idx_gen_virt_vc_data_wr/}

  # This should NOT be covering for 'data'
  do_eqp_test index-vcov-1.5 {
    SELECT id, data, gen_virt FROM t_gen_wr INDEXED BY idx_gen_virt_id_vc_wr WHERE id = 1;
  } {/SEARCH t_gen_wr USING INDEX idx_gen_virt_id_vc_wr/}
  # Verify the above EQP does not say COVERING
  do_eqp_test index-vcov-1.5.notcovering {
    SELECT id, data, gen_virt FROM t_gen_wr INDEXED BY idx_gen_virt_id_vc_wr WHERE id = 1;
  } {/(?!COVERING)SEARCH t_gen_wr USING INDEX idx_gen_virt_id_vc_wr/}


  # Result Correctness Tests for t_gen_wr
  do_test index-vcov-1.6 {
    execsql {
      SELECT gen_virt FROM t_gen_wr INDEXED BY idx_gen_virt_vc_wr WHERE gen_virt = '2:TWO';
    }
  } {{2:TWO}}

  do_test index-vcov-1.7 {
    execsql {
      SELECT id, gen_virt FROM t_gen_wr INDEXED BY idx_gen_virt_id_vc_wr WHERE id = 2;
    }
  } {{2 2:TWO}}

  do_test index-vcov-1.8 {
    execsql {
      SELECT data, gen_virt FROM t_gen_wr INDEXED BY idx_gen_virt_vc_data_wr WHERE data = 'two';
    }
  } {{two 2:TWO}}

  do_test index-vcov-1.9 {
    execsql {
      SELECT id, data, gen_virt FROM t_gen_wr INDEXED BY idx_gen_virt_id_vc_wr WHERE id = 1;
    }
  } {{1 one 1:ONE}}

  do_test index-vcov-1.10 {
    execsql {
      SELECT id, gen_virt FROM t_gen_wr INDEXED BY idx_gen_virt_vc_wr WHERE id = 3; -- id not in this index, forces lookup
    }
  } {{3 3:THREE}}

  # EQP test where id is in PK but not in the explicit index idx_gen_virt_vc_wr
  # The virtual column gen_virt depends on id.
  # If gen_virt can be computed from the index, it's covering for gen_virt.
  # But the WHERE clause on `id` might force a table scan or PK lookup if `id` itself is not in the index.
  # However, for WITHOUT ROWID, id IS the rowid and part of the PK.
  # The crucial part is if `gen_virt` is fetched from the index.
  # If the query optimizer decides to use the PK for `id` and then idx_gen_virt_vc_wr for gen_virt,
  # it's not a simple "COVERING" scan of idx_gen_virt_vc_wr.
  # Let's test selecting only gen_virt.
  do_eqp_test index-vcov-1.11 {
    SELECT gen_virt FROM t_gen_wr INDEXED BY idx_gen_virt_vc_wr WHERE id = 1;
  } {/SEARCH t_gen_wr USING INDEX idx_gen_virt_vc_wr/}
  # It should use the index, but it won't be "COVERING" for the `id` in WHERE.

}

ifcapable generated_columns {
  do_test index-vcov-2.1 {
    execsql {
      CREATE TABLE t_gen_std (
        id INTEGER PRIMARY KEY,
        data TEXT,
        gen_virt AS (id || ':' || upper(data)) VIRTUAL
      );
      INSERT INTO t_gen_std(id, data) VALUES (1, 'one'), (2, 'two'), (3, 'three');

      CREATE INDEX idx_gen_virt_vc_std ON t_gen_std(gen_virt);
      CREATE INDEX idx_gen_virt_vc_data_std ON t_gen_std(gen_virt, data);
      CREATE INDEX idx_gen_virt_id_vc_std ON t_gen_std(id, gen_virt);
    }
  } {}

  # EQP Tests for t_gen_std
  do_eqp_test index-vcov-2.2 {
    SELECT gen_virt FROM t_gen_std INDEXED BY idx_gen_virt_vc_std WHERE gen_virt = '2:TWO';
  } {/SEARCH t_gen_std USING COVERING INDEX idx_gen_virt_vc_std/}

  do_eqp_test index-vcov-2.3 {
    SELECT id, gen_virt FROM t_gen_std INDEXED BY idx_gen_virt_id_vc_std WHERE id = 2;
  } {/SEARCH t_gen_std USING COVERING INDEX idx_gen_virt_id_vc_std/}

  do_eqp_test index-vcov-2.4 {
    SELECT data, gen_virt FROM t_gen_std INDEXED BY idx_gen_virt_vc_data_std WHERE data = 'two';
  } {/SEARCH t_gen_std USING COVERING INDEX idx_gen_virt_vc_data_std/}
  
  # This should NOT be covering for 'data'
  do_eqp_test index-vcov-2.5 {
    SELECT id, data, gen_virt FROM t_gen_std INDEXED BY idx_gen_virt_id_vc_std WHERE id = 1;
  } {/SEARCH t_gen_std USING INDEX idx_gen_virt_id_vc_std/}
  # Verify the above EQP does not say COVERING
  do_eqp_test index-vcov-2.5.notcovering {
    SELECT id, data, gen_virt FROM t_gen_std INDEXED BY idx_gen_virt_id_vc_std WHERE id = 1;
  } {/(?!COVERING)SEARCH t_gen_std USING INDEX idx_gen_virt_id_vc_std/}

  # Result Correctness Tests for t_gen_std
  do_test index-vcov-2.6 {
    execsql {
      SELECT gen_virt FROM t_gen_std INDEXED BY idx_gen_virt_vc_std WHERE gen_virt = '2:TWO';
    }
  } {{2:TWO}}

  do_test index-vcov-2.7 {
    execsql {
      SELECT id, gen_virt FROM t_gen_std INDEXED BY idx_gen_virt_id_vc_std WHERE id = 2;
    }
  } {{2 2:TWO}}

  do_test index-vcov-2.8 {
    execsql {
      SELECT data, gen_virt FROM t_gen_std INDEXED BY idx_gen_virt_vc_data_std WHERE data = 'two';
    }
  } {{two 2:TWO}}

  do_test index-vcov-2.9 {
    execsql {
      SELECT id, data, gen_virt FROM t_gen_std INDEXED BY idx_gen_virt_id_vc_std WHERE id = 1;
    }
  } {{1 one 1:ONE}}
  
  do_test index-vcov-2.10 {
    execsql {
      SELECT id, gen_virt FROM t_gen_std INDEXED BY idx_gen_virt_vc_std WHERE id = 3;
    }
  } {{3 3:THREE}}
}

# Tests for complex generated expressions (e.g., using functions)
ifcapable generated_columns {
  do_test index-vcov-3.1 {
    execsql {
      CREATE TABLE t_gen_func (
        id INTEGER PRIMARY KEY,
        data TEXT,
        gen_len AS (length(data)) VIRTUAL
      );
      INSERT INTO t_gen_func(id, data) VALUES (1, 'abc'), (2, 'defg'), (3, 'hijkl');
      CREATE INDEX idx_gen_len ON t_gen_func(gen_len);
    }
  } {}

  do_eqp_test index-vcov-3.2 {
    SELECT gen_len FROM t_gen_func INDEXED BY idx_gen_len WHERE gen_len = 4;
  } {/SEARCH t_gen_func USING COVERING INDEX idx_gen_len/}

  do_test index-vcov-3.3 {
    execsql {
      SELECT gen_len FROM t_gen_func INDEXED BY idx_gen_len WHERE gen_len = 4 ORDER BY id;
    }
  } {4}
  
  do_test index-vcov-3.4 {
    execsql {
      SELECT id, gen_len FROM t_gen_func INDEXED BY idx_gen_len WHERE data = 'abc'; -- data not in index
    }
  } {{1 3}}
}

# Tests for generated column not in index
ifcapable {generated_columns && without_rowid} {
  do_test index-vcov-4.1 {
    execsql {
      CREATE TABLE t_gen_other_wr (
        id INTEGER PRIMARY KEY,
        data TEXT,
        gen1 AS (id+length(data)) VIRTUAL,
        gen2 AS (id*length(data)) VIRTUAL
      ) WITHOUT ROWID;
      INSERT INTO t_gen_other_wr(id, data) VALUES (1, 'a'), (2, 'bb'), (3, 'ccc');
      CREATE INDEX idx_gen_other_1_wr ON t_gen_other_wr(gen1);
    }
  } {}

  # gen1 from index, gen2 requires computation/table access
  do_eqp_test index-vcov-4.2 {
    SELECT gen1, gen2 FROM t_gen_other_wr INDEXED BY idx_gen_other_1_wr WHERE id = 2;
  } {/SEARCH t_gen_other_wr USING INDEX idx_gen_other_1_wr/}
  # Verify the above EQP does not say COVERING
  do_eqp_test index-vcov-4.2.notcovering {
    SELECT gen1, gen2 FROM t_gen_other_wr INDEXED BY idx_gen_other_1_wr WHERE id = 2;
  } {/(?!COVERING)SEARCH t_gen_other_wr USING INDEX idx_gen_other_1_wr/}


  do_test index-vcov-4.3 {
    execsql {
      SELECT gen1, gen2 FROM t_gen_other_wr INDEXED BY idx_gen_other_1_wr WHERE id = 2;
    }
  } {{4 4}}

  do_test index-vcov-4.4 {
    execsql {
      SELECT gen1 FROM t_gen_other_wr INDEXED BY idx_gen_other_1_wr WHERE gen1 = 4;
    }
  } {4}
  
  do_eqp_test index-vcov-4.5 {
     SELECT gen1 FROM t_gen_other_wr INDEXED BY idx_gen_other_1_wr WHERE gen1 = 4;
  } {/SEARCH t_gen_other_wr USING COVERING INDEX idx_gen_other_1_wr/}

}

ifcapable generated_columns {
  do_test index-vcov-5.1 {
    execsql {
      CREATE TABLE t_gen_other_std (
        id INTEGER PRIMARY KEY,
        data TEXT,
        gen1 AS (id+length(data)) VIRTUAL,
        gen2 AS (id*length(data)) VIRTUAL
      );
      INSERT INTO t_gen_other_std(id, data) VALUES (1, 'a'), (2, 'bb'), (3, 'ccc');
      CREATE INDEX idx_gen_other_1_std ON t_gen_other_std(gen1);
    }
  } {}

  # gen1 from index, gen2 requires computation/table access
  do_eqp_test index-vcov-5.2 {
    SELECT gen1, gen2 FROM t_gen_other_std INDEXED BY idx_gen_other_1_std WHERE id = 2;
  } {/SEARCH t_gen_other_std USING INDEX idx_gen_other_1_std/}
   # Verify the above EQP does not say COVERING
  do_eqp_test index-vcov-5.2.notcovering {
    SELECT gen1, gen2 FROM t_gen_other_std INDEXED BY idx_gen_other_1_std WHERE id = 2;
  } {/(?!COVERING)SEARCH t_gen_other_std USING INDEX idx_gen_other_1_std/}


  do_test index-vcov-5.3 {
    execsql {
      SELECT gen1, gen2 FROM t_gen_other_std INDEXED BY idx_gen_other_1_std WHERE id = 2;
    }
  } {{4 4}}
  
  do_test index-vcov-5.4 {
    execsql {
      SELECT gen1 FROM t_gen_other_std INDEXED BY idx_gen_other_1_std WHERE gen1 = 4;
    }
  } {4}

  do_eqp_test index-vcov-5.5 {
     SELECT gen1 FROM t_gen_other_std INDEXED BY idx_gen_other_1_std WHERE gen1 = 4;
  } {/SEARCH t_gen_other_std USING COVERING INDEX idx_gen_other_1_std/}
}

# Additional test for WITHOUT ROWID table where PK is part of the generated column.
# And index is on the generated column only.
# Query selects only the generated column, but filters on PK.
ifcapable {generated_columns && without_rowid} {
  do_test index-vcov-6.1 {
    execsql {
      CREATE TABLE t_gen_wr2 (
        id INTEGER,
        data TEXT,
        id2 INTEGER,
        gen_virt AS (id || ':' || upper(data) || ':' || id2) VIRTUAL,
        PRIMARY KEY(id, id2)
      ) WITHOUT ROWID;
      INSERT INTO t_gen_wr2(id, data, id2) VALUES (1, 'one', 101), (2, 'two', 202), (3, 'three', 303);
      CREATE INDEX idx_gen_virt_vc_wr2 ON t_gen_wr2(gen_virt);
    }
  } {}

  # EQP: Select gen_virt, filter by id. idx_gen_virt_vc_wr2 contains gen_virt.
  # The expression for gen_virt contains 'id'.
  # Since 'id' is part of PK for WITHOUT ROWID, it's implicitly available to covering index checks.
  # The planner should realize idx_gen_virt_vc_wr2 can be covering if gen_virt is the only thing selected.
  # The WHERE clause on 'id' is the tricky part.
  # If 'id' can be satisfied by the index for the WHERE clause, then it's covering.
  # However, idx_gen_virt_vc_wr2 is *only* on gen_virt.
  # This will likely require a PK lookup (which is the table itself for WR) for the WHERE clause,
  # and then the gen_virt can be computed or fetched.
  # If the optimization works, gen_virt is fetched from the index, after PK lookup.
  # The EQP might show "SEARCH ... USING INDEX ... (id=?)" if it uses the PK,
  # or "SCAN ... USING COVERING INDEX" if it somehow uses the gen_virt index to satisfy `id` (less likely).
  # Let's test selecting only gen_virt and filtering by gen_virt.
  do_eqp_test index-vcov-6.2 {
    SELECT gen_virt FROM t_gen_wr2 INDEXED BY idx_gen_virt_vc_wr2 WHERE gen_virt = '2:TWO:202';
  } {/SEARCH t_gen_wr2 USING COVERING INDEX idx_gen_virt_vc_wr2/}

  # Now, the more complex case: select gen_virt, filter by id.
  # If the generated column's own definition (id || ':' || upper(data) || ':' || id2)
  # is part of the idx_gen_virt_vc_wr2 (which it is, as it's the indexed column),
  # and the query only selects gen_virt, it should be covering.
  # The WHERE id=2 part: for WITHOUT ROWID, id is part of PK.
  # The query plan should be "SEARCH ... USING PRIMARY KEY ... then compute/filter gen_virt"
  # OR "SCAN ... USING COVERING INDEX idx_gen_virt_vc_wr2 ... then filter gen_virt and id (if id also in gen_virt)"
  #
  # The key is whether the value of `gen_virt` is read from the index `idx_gen_virt_vc_wr2`
  # or recomputed after a PK lookup.
  # If the previous change (sqlite3ExprCodeGetColumnOfTable) works,
  # after a PK lookup for `id=2`, when `gen_virt` is needed, it should be
  # recognized as being available in `idx_gen_virt_vc_wr2` if that index is also being used.
  # But here we are *forcing* idx_gen_virt_vc_wr2.
  # This index does not help with `WHERE id=2`. So it's a SCAN.
  # Once a row is found, `gen_virt` is needed. It should come from the index.
  do_eqp_test index-vcov-6.3 {
    SELECT gen_virt FROM t_gen_wr2 INDEXED BY idx_gen_virt_vc_wr2 WHERE id = 2;
  } {/SCAN t_gen_wr2 USING COVERING INDEX idx_gen_virt_vc_wr2/}

  do_test index-vcov-6.4 {
    execsql { SELECT gen_virt FROM t_gen_wr2 INDEXED BY idx_gen_virt_vc_wr2 WHERE id = 2; }
  } {2:TWO:202}

  # Test with an index on (id, gen_virt) for WR table
  do_test index-vcov-6.5 {
    execsql { CREATE INDEX idx_id_gen_virt_wr2 ON t_gen_wr2(id, gen_virt); }
  } {}

  do_eqp_test index-vcov-6.6 {
    SELECT id, gen_virt FROM t_gen_wr2 INDEXED BY idx_id_gen_virt_wr2 WHERE id = 1;
  } {/SEARCH t_gen_wr2 USING COVERING INDEX idx_id_gen_virt_wr2/}

  do_test index-vcov-6.7 {
    execsql { SELECT id, gen_virt FROM t_gen_wr2 INDEXED BY idx_id_gen_virt_wr2 WHERE id = 1; }
  } {{1 1:ONE:101}}

}


finish_test
